{
  "target": "StackPilot",
  "positioning_summary": "StackPilot appears positioned based on extracted signals in pricing, features, and target-customer language.",
  "key_differentiators": [
    {
      "claim": "Native integrations with Salesforce, HubSpot, and Snowflake.",
      "evidence_ids": [
        "e1"
      ],
      "signal_strength": "medium"
    }
  ],
  "pricing_signals": [],
  "target_segments": [],
  "identified_weaknesses": [],
  "conflicts": [],
  "evidence_map": [
    {
      "evidence_id": "e1",
      "doc_id": "k1",
      "quote": "Native integrations with Salesforce, HubSpot, and Snowflake."
    }
  ],
  "confidence": {
    "overall": "low",
    "notes": "Rule-based baseline; improve with stronger semantic extraction in Week 3."
  }
}