{
  "target": "BrandFlow",
  "positioning_summary": "Insufficient evidence",
  "key_differentiators": [],
  "pricing_signals": [],
  "target_segments": [],
  "identified_weaknesses": [],
  "conflicts": [],
  "evidence_map": [],
  "confidence": {
    "overall": "low",
    "notes": "Rule-based baseline; improve with stronger semantic extraction in Week 3."
  }
}