{
  "target": "TaskOrbit",
  "positioning_summary": "TaskOrbit appears positioned based on extracted signals in pricing, features, and target-customer language.",
  "key_differentiators": [],
  "pricing_signals": [
    {
      "claim": "TaskOrbit launches at $15/user monthly.",
      "evidence_ids": [
        "e1"
      ],
      "pricing_type": "seat_based"
    },
    {
      "claim": "Starter plan is now $25/user monthly after adding workflow automation.",
      "evidence_ids": [
        "e2"
      ],
      "pricing_type": "seat_based"
    }
  ],
  "target_segments": [],
  "identified_weaknesses": [],
  "conflicts": [
    {
      "topic": "pricing",
      "claims": [
        {
          "statement": "t1 lists minimum entry price $15",
          "evidence_ids": [
            "e1"
          ]
        },
        {
          "statement": "t2 lists minimum entry price $25",
          "evidence_ids": [
            "e2"
          ]
        }
      ],
      "resolution_status": "partially_resolved",
      "resolution_rationale": "Newer source (t2, 2026-04-25) may reflect updated pricing, but historical claim is retained as conflict."
    }
  ],
  "evidence_map": [
    {
      "evidence_id": "e1",
      "doc_id": "t1",
      "quote": "TaskOrbit launches at $15/user monthly."
    },
    {
      "evidence_id": "e2",
      "doc_id": "t2",
      "quote": "Starter plan is now $25/user monthly after adding workflow automation."
    }
  ],
  "confidence": {
    "overall": "low",
    "notes": "Rule-based baseline; improve with stronger semantic extraction in Week 3."
  }
}