{
  "target": "InsightLoop",
  "positioning_summary": "InsightLoop appears positioned based on extracted signals in pricing, features, and target-customer language.",
  "key_differentiators": [
    {
      "claim": "Custom dashboards are available only on Pro and Enterprise tiers.",
      "evidence_ids": [
        "e1"
      ],
      "signal_strength": "medium"
    }
  ],
  "pricing_signals": [],
  "target_segments": [
    {
      "segment": "Enterprise",
      "evidence_ids": [
        "e1"
      ]
    }
  ],
  "identified_weaknesses": [
    {
      "weakness": "Custom dashboards are available only on Pro and Enterprise tiers.",
      "evidence_ids": [
        "e1"
      ]
    }
  ],
  "conflicts": [],
  "evidence_map": [
    {
      "evidence_id": "e1",
      "doc_id": "q1",
      "quote": "Custom dashboards are available only on Pro and Enterprise tiers."
    }
  ],
  "confidence": {
    "overall": "low",
    "notes": "Rule-based baseline; improve with stronger semantic extraction in Week 3."
  }
}